-- The computed entity-graph tables under greptime_private are read-only
-- virtual tables: readable, but rejecting every DDL/DML path.
select observed_at, entity_type, entity_id, scope from greptime_private.semantic_entities;

++
++

select observed_at, src_id, dst_id, rel_type from greptime_private.semantic_relationships;

++
++

insert into greptime_private.semantic_entities (observed_at, entity_type, entity_id) values (now(), 'service', 'svc-a');

Error: 1001(Unsupported), Cannot change read-only table: semantic_entities

-- Plain-literal VALUES takes the direct region-insert path, not the query
-- engine; the table-level guard must hold there too.
insert into greptime_private.semantic_entities (observed_at, entity_type, entity_id) values (0, 'service', 'svc-b');

Error: 1001(Unsupported), Table `semantic_entities` is read-only

create table greptime_private.semantic_entities (ts timestamp time index);

Error: 1001(Unsupported), Table `semantic_entities` is read-only

create table greptime_private.semantic_relationships (ts timestamp time index);

Error: 1001(Unsupported), Table `semantic_relationships` is read-only

alter table greptime_private.semantic_entities add column extra string;

Error: 1001(Unsupported), Table `semantic_entities` is read-only

truncate table greptime_private.semantic_entities;

Error: 1001(Unsupported), Table `semantic_entities` is read-only

drop table greptime_private.semantic_entities;

Error: 1001(Unsupported), Table `semantic_entities` is read-only

drop table greptime_private.semantic_relationships;

Error: 1001(Unsupported), Table `semantic_relationships` is read-only

-- Read-time derivation: declare entity identities on a user table and observe
-- them in the computed registry (single-column and composite ids, scope and
-- descriptive columns, JSON output columns).
create table graph_app_latency (
  ts timestamp time index,
  service_name string,
  host string,
  env string,
  latency double,
  primary key (service_name, host, env)
) with (
  'greptime.semantic.entity.service.id' = 'service_name',
  'greptime.semantic.entity.service.scope' = 'env',
  'greptime.semantic.entity.process.id' = 'service_name,host',
  'greptime.semantic.entity.process.descriptive' = 'env'
);

Affected Rows: 0

insert into graph_app_latency values (now(), 'cart', 'h1', 'us-east', 3.5);

Affected Rows: 1

-- SQLNESS PROTOCOL MYSQL
select entity_type, entity_id, entity_id_attrs, scope, descriptive, source_tables
from greptime_private.semantic_entities
order by entity_type, entity_id;

+-------------+---------------------------+-------------------------------------+---------+-------------------+------------------------------+
| entity_type | entity_id                 | entity_id_attrs                     | scope   | descriptive       | source_tables                |
+-------------+---------------------------+-------------------------------------+---------+-------------------+------------------------------+
| process     | host=h1,service_name=cart | {"host":"h1","service_name":"cart"} |         | {"env":"us-east"} | ["public.graph_app_latency"] |
| service     | cart                      |                                     | us-east |                   | ["public.graph_app_latency"] |
+-------------+---------------------------+-------------------------------------+---------+-------------------+------------------------------+

drop table graph_app_latency;

Affected Rows: 0

-- Renaming a physical table INTO a reserved computed-table name would let the
-- overlay shadow it, orphaning its data.
create table greptime_private.graph_rename_probe (ts timestamp time index);

Affected Rows: 0

alter table greptime_private.graph_rename_probe rename semantic_entities;

Error: 1001(Unsupported), Table `semantic_entities` is read-only

drop table greptime_private.graph_rename_probe;

Affected Rows: 0

-- Calls derivation: a trace-v1-model table with client/server span pairs.
-- Trace tables need no entity declaration: the service entities are implicit.
create table graph_traces (
  "timestamp" timestamp(9) time index,
  trace_id string,
  span_id string,
  parent_span_id string,
  span_kind string,
  span_status_code string,
  service_name string,
  duration_nano bigint unsigned,
  primary key (service_name)
) with ('table_data_model' = 'greptime_trace_v1', 'append_mode' = 'true');

Affected Rows: 0

-- The epoch-timestamped pair falls outside the default one-hour derivation
-- window and must not appear in the results.
insert into graph_traces values
  (now(), 't1', 'c1', NULL, 'SPAN_KIND_CLIENT', 'STATUS_CODE_UNSET', 'frontend', 0),
  (now(), 't1', 's1', 'c1', 'SPAN_KIND_SERVER', 'STATUS_CODE_ERROR', 'cart', 1500000000),
  (now(), 't2', 'c2', NULL, 'SPAN_KIND_CLIENT', 'STATUS_CODE_UNSET', 'frontend', 0),
  (now(), 't2', 's2', 'c2', 'SPAN_KIND_SERVER', 'STATUS_CODE_UNSET', 'cart', 500000000),
  (0, 't0', 'c0', NULL, 'SPAN_KIND_CLIENT', 'STATUS_CODE_UNSET', 'stale-src', 0),
  (0, 't0', 's0', 'c0', 'SPAN_KIND_SERVER', 'STATUS_CODE_UNSET', 'stale-dst', 100);

Affected Rows: 6

-- SQLNESS PROTOCOL MYSQL
select src_type, src_id, dst_type, dst_id, rel_type, provenance, confidence,
  request_count, error_count, duration_sum, duration_count, attributes
from greptime_private.semantic_relationships
order by src_id;

+----------+----------+----------+--------+----------+------------+------------+---------------+-------------+--------------+----------------+------------+
| src_type | src_id   | dst_type | dst_id | rel_type | provenance | confidence | request_count | error_count | duration_sum | duration_count | attributes |
+----------+----------+----------+--------+----------+------------+------------+---------------+-------------+--------------+----------------+------------+
| service  | frontend | service  | cart   | calls    | trace      | 1          | 2             | 1           | 2            | 2              |            |
+----------+----------+----------+--------+----------+------------+------------+---------------+-------------+--------------+----------------+------------+

-- SQLNESS PROTOCOL MYSQL
select entity_type, entity_id, entity_id_attrs, scope, source_tables
from greptime_private.semantic_entities
order by entity_id;

+-------------+-----------+-----------------+-------+-------------------------+
| entity_type | entity_id | entity_id_attrs | scope | source_tables           |
+-------------+-----------+-----------------+-------+-------------------------+
| service     | cart      |                 |       | ["public.graph_traces"] |
| service     | frontend  |                 |       | ["public.graph_traces"] |
+-------------+-----------+-----------------+-------+-------------------------+

drop table graph_traces;

Affected Rows: 0

-- Declared edges: the physical table is created by the system on the first
-- INSERT with its canonical schema. Re-asserting an edge stores a new revision;
-- reads keep only the latest one per edge key.
insert into greptime_private.semantic_relationships_declared
  (observed_at, src_type, src_id, rel_type, dst_type, dst_id, provenance, scope, generation_id, confidence)
values (now() - interval '10 minute', 'service', 'frontend', 'depends_on', 'service', 'users-db', 'declared', '', '', 0.5);

Affected Rows: 1

insert into greptime_private.semantic_relationships_declared
  (observed_at, src_type, src_id, rel_type, dst_type, dst_id, provenance, scope, generation_id, confidence)
values (now() - interval '5 minute', 'service', 'frontend', 'depends_on', 'service', 'users-db', 'declared', '', '', 1.0);

Affected Rows: 1

-- An old open-ended declaration stays valid until its row expires; an edge
-- retired in the past must not appear.
insert into greptime_private.semantic_relationships_declared
  (observed_at, src_type, src_id, rel_type, dst_type, dst_id, provenance, scope, generation_id, valid_until)
values
  ('1970-01-01 00:00:01', 'service', 'legacy', 'depends_on', 'service', 'mainframe', 'declared', '', '', NULL),
  ('1970-01-01 00:00:01', 'service', 'retired', 'depends_on', 'service', 'oldsys', 'declared', '', '', '2000-01-01 00:00:00');

Affected Rows: 2

select src_id, dst_id, rel_type, provenance, confidence
from greptime_private.semantic_relationships
order by src_id;

+----------+-----------+------------+------------+------------+
| src_id   | dst_id    | rel_type   | provenance | confidence |
+----------+-----------+------------+------------+------------+
| frontend | users-db  | depends_on | declared   | 1.0        |
| legacy   | mainframe | depends_on | declared   |            |
+----------+-----------+------------+------------+------------+

-- An explicit observed_at window replaces the default last hour; the emitted
-- timestamps of declared edges are synthesized inside the queried window.
select observed_at, window_start, fresh_until, src_id, dst_id
from greptime_private.semantic_relationships
where observed_at >= '2001-01-01 00:00:00' and observed_at < '2001-01-02 00:00:00'
order by src_id;

+---------------------+---------------------+---------------------+--------+-----------+
| observed_at         | window_start        | fresh_until         | src_id | dst_id    |
+---------------------+---------------------+---------------------+--------+-----------+
| 2001-01-01T00:00:00 | 1970-01-01T00:00:01 | 2001-01-02T00:00:00 | legacy | mainframe |
+---------------------+---------------------+---------------------+--------+-----------+

-- A lower bound alone is fine (the upper bound defaults to now)...
select src_id, dst_id, provenance
from greptime_private.semantic_relationships
where observed_at >= now() - interval '30 minute'
order by src_id;

+----------+-----------+------------+
| src_id   | dst_id    | provenance |
+----------+-----------+------------+
| frontend | users-db  | declared   |
| legacy   | mainframe | declared   |
+----------+-----------+------------+

-- ...but an upper bound alone would scan unbounded history: explicit error.
select src_id from greptime_private.semantic_relationships
where observed_at < '2001-01-02 00:00:00';

Error: 3001(EngineExecuteQuery), Invalid SQL, error: the observed_at filter has no lower bound; the graph cannot derive over unbounded history — add e.g. observed_at >= '2026-01-01 00:00:00'

-- The declared-edge table's definition is system-owned: user CREATE/ALTER are
-- rejected and a physical table cannot be renamed into the name, while plain
-- DML stays allowed.
create table greptime_private.semantic_relationships_declared (ts timestamp time index);

Error: 1001(Unsupported), The definition of table `semantic_relationships_declared` is managed by GreptimeDB; it cannot be created or altered (DROP recreates it on the next write)

alter table greptime_private.semantic_relationships_declared add column extra string;

Error: 1001(Unsupported), The definition of table `semantic_relationships_declared` is managed by GreptimeDB; it cannot be created or altered (DROP recreates it on the next write)

create table greptime_private.declared_rename_probe (ts timestamp time index);

Affected Rows: 0

alter table greptime_private.declared_rename_probe rename semantic_relationships_declared;

Error: 1001(Unsupported), The definition of table `semantic_relationships_declared` is managed by GreptimeDB; it cannot be created or altered (DROP recreates it on the next write)

drop table greptime_private.declared_rename_probe;

Affected Rows: 0

delete from greptime_private.semantic_relationships_declared;

Affected Rows: 4

select src_id from greptime_private.semantic_relationships order by src_id;

++
++

-- DROP is allowed (nothing structural is lost: the next INSERT recreates the
-- canonical table) and cleans up after this test.
drop table greptime_private.semantic_relationships_declared;

Affected Rows: 0

insert into greptime_private.semantic_relationships_declared
  (observed_at, src_type, src_id, rel_type, dst_type, dst_id, provenance, scope, generation_id)
values (now(), 'service', 'reborn', 'depends_on', 'service', 'db', 'declared', '', '');

Affected Rows: 1

select src_id from greptime_private.semantic_relationships order by src_id;

+--------+
| src_id |
+--------+
| reborn |
+--------+

drop table greptime_private.semantic_relationships_declared;

Affected Rows: 0

-- Same-row co-declaration: a table declaring both entity types of a built-in
-- vocabulary pair witnesses the edge on every row carrying both identities;
-- the vocabulary fixes the direction.
create table graph_pod_metrics (
  ts timestamp time index,
  instance string,
  host string,
  "service" string,
  cpu double,
  primary key (instance, host, "service")
) with (
  'greptime.semantic.entity.service.instance.id' = 'instance',
  'greptime.semantic.entity.host.id' = 'host',
  'greptime.semantic.entity.service.id' = 'service'
);

Affected Rows: 0

insert into graph_pod_metrics values (now(), 'cart-0', 'node-1', 'cart', 0.5);

Affected Rows: 1

select src_type, src_id, dst_type, dst_id, rel_type, provenance, confidence
from greptime_private.semantic_relationships
order by rel_type, src_id;

+------------------+--------+----------+--------+----------+------------+------------+
| src_type         | src_id | dst_type | dst_id | rel_type | provenance | confidence |
+------------------+--------+----------+--------+----------+------------+------------+
| service.instance | cart-0 | service  | cart   | part_of  | attribute  | 1.0        |
| service.instance | cart-0 | host     | node-1 | runs_on  | attribute  | 1.0        |
+------------------+--------+----------+--------+----------+------------+------------+

drop table graph_pod_metrics;

Affected Rows: 0

-- Cross-table calls pairing: the client span and its child server span land in
-- different trace tables and must still pair into one edge. A trace-model
-- table that lost the fixed span columns is skipped instead of failing the
-- scan.
create table graph_traces_a (
  "timestamp" timestamp(9) time index,
  trace_id string,
  span_id string,
  parent_span_id string,
  span_kind string,
  span_status_code string,
  service_name string,
  duration_nano bigint unsigned,
  primary key (service_name)
) with ('table_data_model' = 'greptime_trace_v1', 'append_mode' = 'true');

Affected Rows: 0

create table graph_traces_b (
  "timestamp" timestamp(9) time index,
  trace_id string,
  span_id string,
  parent_span_id string,
  span_kind string,
  span_status_code string,
  service_name string,
  duration_nano bigint unsigned,
  primary key (service_name)
) with ('table_data_model' = 'greptime_trace_v1', 'append_mode' = 'true');

Affected Rows: 0

create table graph_traces_malformed (
  ts timestamp time index,
  note string
) with ('table_data_model' = 'greptime_trace_v1');

Affected Rows: 0

insert into graph_traces_a values
  (now(), 't1', 'c1', NULL, 'SPAN_KIND_CLIENT', 'STATUS_CODE_UNSET', 'frontend', 0);

Affected Rows: 1

insert into graph_traces_b values
  (now(), 't1', 's1', 'c1', 'SPAN_KIND_SERVER', 'STATUS_CODE_ERROR', 'cart', 1500000000);

Affected Rows: 1

insert into graph_traces_malformed values (now(), 'not a trace');

Affected Rows: 1

select src_id, dst_id, rel_type, provenance, confidence, request_count, error_count
from greptime_private.semantic_relationships
order by src_id;

+----------+--------+----------+------------+------------+---------------+-------------+
| src_id   | dst_id | rel_type | provenance | confidence | request_count | error_count |
+----------+--------+----------+------------+------------+---------------+-------------+
| frontend | cart   | calls    | trace      | 1.0        | 1             | 1           |
+----------+--------+----------+------------+------------+---------------+-------------+

drop table graph_traces_a;

Affected Rows: 0

drop table graph_traces_b;

Affected Rows: 0

drop table graph_traces_malformed;

Affected Rows: 0

-- Virtual nodes: a client span with no matching server span names its peer
-- through span attributes; the edge carries confidence < 1.0 and the
-- connection type.
create table graph_traces_virtual (
  "timestamp" timestamp(9) time index,
  trace_id string,
  span_id string,
  parent_span_id string,
  span_kind string,
  span_status_code string,
  service_name string,
  duration_nano bigint unsigned,
  "span_attributes.peer.service" string,
  "span_attributes.db.name" string,
  primary key (service_name)
) with ('table_data_model' = 'greptime_trace_v1', 'append_mode' = 'true');

Affected Rows: 0

insert into graph_traces_virtual values
  (now(), 't1', 'c1', NULL, 'SPAN_KIND_CLIENT', 'STATUS_CODE_UNSET', 'frontend', 250000000, 'redis', NULL),
  (now(), 't2', 'c2', NULL, 'SPAN_KIND_CLIENT', 'STATUS_CODE_UNSET', 'frontend', 100000000, NULL, 'orders-db');

Affected Rows: 2

-- SQLNESS PROTOCOL MYSQL
select src_id, dst_id, rel_type, confidence, request_count, attributes
from greptime_private.semantic_relationships
order by dst_id;

+----------+-----------+----------+------------+---------------+------------------------------------+
| src_id   | dst_id    | rel_type | confidence | request_count | attributes                         |
+----------+-----------+----------+------------+---------------+------------------------------------+
| frontend | orders-db | calls    | 0.5        | 1             | {"connection_type":"database"}     |
| frontend | redis     | calls    | 0.5        | 1             | {"connection_type":"virtual_node"} |
+----------+-----------+----------+------------+---------------+------------------------------------+

drop table graph_traces_virtual;

Affected Rows: 0

-- Agent edges: span structure derives parent_agent calls agent, and span rows
-- co-declaring agent+model / agent+tool witness uses / invokes.
create table graph_agent_traces (
  "timestamp" timestamp(9) time index,
  trace_id string,
  span_id string,
  parent_span_id string,
  span_kind string,
  span_status_code string,
  service_name string,
  duration_nano bigint unsigned,
  agent_id string,
  model_name string,
  tool_name string,
  primary key (service_name, agent_id, model_name, tool_name)
) with (
  'table_data_model' = 'greptime_trace_v1',
  'append_mode' = 'true',
  'greptime.semantic.entity.gen_ai.agent.id' = 'agent_id',
  'greptime.semantic.entity.gen_ai.model.id' = 'model_name',
  'greptime.semantic.entity.gen_ai.tool.id' = 'tool_name'
);

Affected Rows: 0

insert into graph_agent_traces values
  (now(), 't1', 'p1', NULL, 'SPAN_KIND_INTERNAL', 'STATUS_CODE_UNSET', 'app', 0, 'orchestrator', NULL, NULL),
  (now(), 't1', 'a1', 'p1', 'SPAN_KIND_INTERNAL', 'STATUS_CODE_UNSET', 'app', 2000000000, 'researcher', 'gpt-5', NULL),
  (now(), 't1', 'a2', 'a1', 'SPAN_KIND_INTERNAL', 'STATUS_CODE_UNSET', 'app', 500000000, 'researcher', NULL, 'web_search');

Affected Rows: 3

select src_type, src_id, dst_type, dst_id, rel_type, provenance
from greptime_private.semantic_relationships
order by rel_type, dst_id;

+----------+--------------+----------+------------+----------+------------+
| src_type | src_id       | dst_type | dst_id     | rel_type | provenance |
+----------+--------------+----------+------------+----------+------------+
| agent    | orchestrator | agent    | researcher | calls    | trace      |
| agent    | researcher   | tool     | web_search | invokes  | trace      |
| agent    | researcher   | model    | gpt-5      | uses     | trace      |
+----------+--------------+----------+------------+----------+------------+

drop table graph_agent_traces;

Affected Rows: 0

