CREATE TABLE jsons (j JSON, t timestamp time index);

Affected Rows: 0

--Insert valid json strings--
INSERT INTO jsons VALUES('[null]', 0),
('[true]', 1),
('[false]', 2),
('[0]', 3),
('["foo"]', 4),
('[]', 5),
('{}', 6),
('[0,1]', 7),
('{"foo":"bar"}', 8),
('{"a":null,"foo":"bar"}', 9),
('[-1]', 10),
('{"entities": {
    "description": {
        "urls": [
            {
                "url": "http://t.co/QMLJeFmfMT",
                "expanded_url": "http://www.pixiv.net/member.php?id=4776",
                "display_url": "pixiv.net/member.php?id=…",
                "indices": [
                    58,
                    80
                ]
            },
            {
                "url": "http://t.co/LU8T7vmU3h",
                "expanded_url": "http://ask.fm/KATANA77",
                "display_url": "ask.fm/KATANA77",
                "indices": [
                    95,
                    117
                ]
            }
        ]
    }
}}', 11);

Affected Rows: 12

INSERT INTO jsons VALUES(parse_json('[null]'), 12),
(parse_json('[true]'), 13),
(parse_json('[false]'), 14),
(parse_json('[0]'), 15),
(parse_json('["foo"]'), 16),
(parse_json('[]'), 17),
(parse_json('{}'), 18),
(parse_json('[0,1]'), 19),
(parse_json('{"foo":"bar"}'), 20),
(parse_json('{"a":null,"foo":"bar"}'), 21),
(parse_json('[-1]'), 22),
(parse_json('[-2147483648]'), 23),
(parse_json('{"entities": {
            "description": {
                "urls": [
                    {
                        "url": "http://t.co/QMLJeFmfMT",
                        "expanded_url": "http://www.pixiv.net/member.php?id=4776",
                        "display_url": "pixiv.net/member.php?id=…",
                        "indices": [
                            58,
                            80
                        ]
                    },
                    {
                        "url": "http://t.co/LU8T7vmU3h",
                        "expanded_url": "http://ask.fm/KATANA77",
                        "display_url": "ask.fm/KATANA77",
                        "indices": [
                            95,
                            117
                        ]
                    }
                ]
            }
        }}'), 24);

Affected Rows: 13

SELECT json_to_string(j), t FROM jsons;

+---------------------------------------------------------------------------------------------------------------------------------------------------------------------------------------------------------------------------------------------------------------------------------------------------------------------------+-------------------------+
| json_to_string(jsons.j)                                                                                                                                                                                                                                                                                                   | t                       |
+---------------------------------------------------------------------------------------------------------------------------------------------------------------------------------------------------------------------------------------------------------------------------------------------------------------------------+-------------------------+
| [null]                                                                                                                                                                                                                                                                                                                    | 1970-01-01T00:00:00     |
| [true]                                                                                                                                                                                                                                                                                                                    | 1970-01-01T00:00:00.001 |
| [false]                                                                                                                                                                                                                                                                                                                   | 1970-01-01T00:00:00.002 |
| [0]                                                                                                                                                                                                                                                                                                                       | 1970-01-01T00:00:00.003 |
| ["foo"]                                                                                                                                                                                                                                                                                                                   | 1970-01-01T00:00:00.004 |
| []                                                                                                                                                                                                                                                                                                                        | 1970-01-01T00:00:00.005 |
| {}                                                                                                                                                                                                                                                                                                                        | 1970-01-01T00:00:00.006 |
| [0,1]                                                                                                                                                                                                                                                                                                                     | 1970-01-01T00:00:00.007 |
| {"foo":"bar"}                                                                                                                                                                                                                                                                                                             | 1970-01-01T00:00:00.008 |
| {"a":null,"foo":"bar"}                                                                                                                                                                                                                                                                                                    | 1970-01-01T00:00:00.009 |
| [-1]                                                                                                                                                                                                                                                                                                                      | 1970-01-01T00:00:00.010 |
| {"entities":{"description":{"urls":[{"display_url":"pixiv.net/member.php?id=…","expanded_url":"http://www.pixiv.net/member.php?id=4776","indices":[58,80],"url":"http://t.co/QMLJeFmfMT"},{"display_url":"ask.fm/KATANA77","expanded_url":"http://ask.fm/KATANA77","indices":[95,117],"url":"http://t.co/LU8T7vmU3h"}]}}} | 1970-01-01T00:00:00.011 |
| [null]                                                                                                                                                                                                                                                                                                                    | 1970-01-01T00:00:00.012 |
| [true]                                                                                                                                                                                                                                                                                                                    | 1970-01-01T00:00:00.013 |
| [false]                                                                                                                                                                                                                                                                                                                   | 1970-01-01T00:00:00.014 |
| [0]                                                                                                                                                                                                                                                                                                                       | 1970-01-01T00:00:00.015 |
| ["foo"]                                                                                                                                                                                                                                                                                                                   | 1970-01-01T00:00:00.016 |
| []                                                                                                                                                                                                                                                                                                                        | 1970-01-01T00:00:00.017 |
| {}                                                                                                                                                                                                                                                                                                                        | 1970-01-01T00:00:00.018 |
| [0,1]                                                                                                                                                                                                                                                                                                                     | 1970-01-01T00:00:00.019 |
| {"foo":"bar"}                                                                                                                                                                                                                                                                                                             | 1970-01-01T00:00:00.020 |
| {"a":null,"foo":"bar"}                                                                                                                                                                                                                                                                                                    | 1970-01-01T00:00:00.021 |
| [-1]                                                                                                                                                                                                                                                                                                                      | 1970-01-01T00:00:00.022 |
| [-2147483648]                                                                                                                                                                                                                                                                                                             | 1970-01-01T00:00:00.023 |
| {"entities":{"description":{"urls":[{"display_url":"pixiv.net/member.php?id=…","expanded_url":"http://www.pixiv.net/member.php?id=4776","indices":[58,80],"url":"http://t.co/QMLJeFmfMT"},{"display_url":"ask.fm/KATANA77","expanded_url":"http://ask.fm/KATANA77","indices":[95,117],"url":"http://t.co/LU8T7vmU3h"}]}}} | 1970-01-01T00:00:00.024 |
+---------------------------------------------------------------------------------------------------------------------------------------------------------------------------------------------------------------------------------------------------------------------------------------------------------------------------+-------------------------+

--Insert invalid json strings--
DELETE FROM jsons;

Affected Rows: 25

INSERT INTO jsons VALUES(parse_json('{"a":1, "b":2, "c":3'), 4);

Error: 3001(EngineExecuteQuery), DataFusion error: Invalid function args: Cannot convert the string to json, have: {"a":1, "b":2, "c":3

INSERT INTO jsons VALUES(parse_json('Morning my friends, have a nice day :)'), 5);

Error: 3001(EngineExecuteQuery), DataFusion error: Invalid function args: Cannot convert the string to json, have: Morning my friends, have a nice day :)

SELECT json_to_string(j), t FROM jsons;

++
++

CREATE TABLE json_empty (j JSON, t timestamp time index);

Affected Rows: 0

INSERT INTO json_empty VALUES(NULL, 2);

Affected Rows: 1

SELECT json_to_string(j), t FROM json_empty;

+------------------------------+-------------------------+
| json_to_string(json_empty.j) | t                       |
+------------------------------+-------------------------+
|                              | 1970-01-01T00:00:00.002 |
+------------------------------+-------------------------+

drop table jsons;

Affected Rows: 0

drop table json_empty;

Affected Rows: 0

